{
  "schemaVersion": 1,
  "project": {
    "name": "sample-app",
    "framework": "next-app-router"
  },
  "nodes": [
    {
      "id": "database:postgres",
      "kind": "database",
      "label": "Postgres",
      "via": "Prisma"
    },
    {
      "id": "file:app/(marketing)/about/page.tsx",
      "kind": "file",
      "path": "app/(marketing)/about/page.tsx",
      "role": "page",
      "urlPath": "/about"
    },
    {
      "id": "file:app/actions.ts",
      "kind": "file",
      "path": "app/actions.ts",
      "role": "server-actions"
    },
    {
      "id": "file:app/api/checkout/route.ts",
      "kind": "file",
      "path": "app/api/checkout/route.ts",
      "role": "route",
      "urlPath": "/api/checkout",
      "methods": [
        "POST"
      ]
    },
    {
      "id": "file:app/api/users/[id]/route.ts",
      "kind": "file",
      "path": "app/api/users/[id]/route.ts",
      "role": "route",
      "urlPath": "/api/users/[id]",
      "methods": [
        "DELETE"
      ]
    },
    {
      "id": "file:app/api/users/route.ts",
      "kind": "file",
      "path": "app/api/users/route.ts",
      "role": "route",
      "urlPath": "/api/users",
      "methods": [
        "GET",
        "POST"
      ]
    },
    {
      "id": "file:app/dashboard/page.tsx",
      "kind": "file",
      "path": "app/dashboard/page.tsx",
      "role": "page",
      "urlPath": "/dashboard"
    },
    {
      "id": "file:app/layout.tsx",
      "kind": "file",
      "path": "app/layout.tsx",
      "role": "layout"
    },
    {
      "id": "file:app/page.tsx",
      "kind": "file",
      "path": "app/page.tsx",
      "role": "page",
      "urlPath": "/"
    },
    {
      "id": "file:app/posts/new/page.tsx",
      "kind": "file",
      "path": "app/posts/new/page.tsx",
      "role": "page",
      "urlPath": "/posts/new"
    },
    {
      "id": "file:app/signup/page.tsx",
      "kind": "file",
      "path": "app/signup/page.tsx",
      "role": "page",
      "urlPath": "/signup"
    },
    {
      "id": "file:components/CheckoutButton.tsx",
      "kind": "file",
      "path": "components/CheckoutButton.tsx",
      "role": "component",
      "client": true
    },
    {
      "id": "file:components/Nav.tsx",
      "kind": "file",
      "path": "components/Nav.tsx",
      "role": "component"
    },
    {
      "id": "file:components/SignupForm.tsx",
      "kind": "file",
      "path": "components/SignupForm.tsx",
      "role": "component",
      "client": true
    },
    {
      "id": "file:components/UserCard.tsx",
      "kind": "file",
      "path": "components/UserCard.tsx",
      "role": "component",
      "client": true
    },
    {
      "id": "file:lib/db.ts",
      "kind": "file",
      "path": "lib/db.ts",
      "role": "module"
    },
    {
      "id": "file:lib/email.ts",
      "kind": "file",
      "path": "lib/email.ts",
      "role": "module"
    },
    {
      "id": "file:lib/stripe.ts",
      "kind": "file",
      "path": "lib/stripe.ts",
      "role": "module"
    },
    {
      "id": "file:lib/validation.ts",
      "kind": "file",
      "path": "lib/validation.ts",
      "role": "module"
    },
    {
      "id": "file:prisma/schema.prisma",
      "kind": "file",
      "path": "prisma/schema.prisma",
      "role": "config"
    },
    {
      "id": "service:resend",
      "kind": "service",
      "label": "Resend",
      "source": "resend"
    },
    {
      "id": "service:stripe",
      "kind": "service",
      "label": "Stripe",
      "source": "stripe"
    },
    {
      "id": "setting:DATABASE_URL",
      "kind": "setting",
      "name": "DATABASE_URL",
      "public": false
    },
    {
      "id": "setting:NEXT_PUBLIC_SITE_URL",
      "kind": "setting",
      "name": "NEXT_PUBLIC_SITE_URL",
      "public": true
    },
    {
      "id": "setting:RESEND_API_KEY",
      "kind": "setting",
      "name": "RESEND_API_KEY",
      "public": false
    },
    {
      "id": "setting:STRIPE_SECRET_KEY",
      "kind": "setting",
      "name": "STRIPE_SECRET_KEY",
      "public": false
    }
  ],
  "connections": [
    {
      "id": "file:app/(marketing)/about/page.tsx->setting:NEXT_PUBLIC_SITE_URL",
      "from": "file:app/(marketing)/about/page.tsx",
      "to": "setting:NEXT_PUBLIC_SITE_URL",
      "kind": "reads-setting",
      "label": "reads setting",
      "locations": [
        {
          "path": "app/(marketing)/about/page.tsx",
          "line": 2,
          "role": "use",
          "code": "return <p>About {process.env.NEXT_PUBLIC_SITE_URL}</p>;"
        }
      ]
    },
    {
      "id": "file:app/actions.ts->database:postgres",
      "from": "file:app/actions.ts",
      "to": "database:postgres",
      "kind": "writes",
      "label": "saves to posts",
      "locations": [
        {
          "path": "app/actions.ts",
          "line": 7,
          "role": "use",
          "code": "await db.post.create({"
        }
      ],
      "details": [
        "posts"
      ]
    },
    {
      "id": "file:app/actions.ts->file:lib/db.ts",
      "from": "file:app/actions.ts",
      "to": "file:lib/db.ts",
      "kind": "uses",
      "label": "uses db",
      "locations": [
        {
          "path": "app/actions.ts",
          "line": 3,
          "role": "import",
          "code": "import { db } from '@/lib/db';"
        },
        {
          "path": "app/actions.ts",
          "line": 7,
          "role": "use",
          "code": "await db.post.create({"
        }
      ]
    },
    {
      "id": "file:app/actions.ts->file:lib/validation.ts",
      "from": "file:app/actions.ts",
      "to": "file:lib/validation.ts",
      "kind": "uses",
      "label": "uses formatTitle",
      "locations": [
        {
          "path": "app/actions.ts",
          "line": 4,
          "role": "import",
          "code": "import { formatTitle } from '@/lib/validation';"
        },
        {
          "path": "app/actions.ts",
          "line": 8,
          "role": "use",
          "code": "data: { title: formatTitle(String(form.get('title'))), authorId: String(form.get('authorId')) },"
        }
      ]
    },
    {
      "id": "file:app/api/checkout/route.ts->file:app/dashboard/page.tsx",
      "from": "file:app/api/checkout/route.ts",
      "to": "file:app/dashboard/page.tsx",
      "kind": "links",
      "label": "sends the user to",
      "locations": [
        {
          "path": "app/api/checkout/route.ts",
          "line": 9,
          "role": "use",
          "code": "success_url: `${process.env.NEXT_PUBLIC_SITE_URL}/dashboard`,"
        }
      ]
    },
    {
      "id": "file:app/api/checkout/route.ts->file:lib/stripe.ts",
      "from": "file:app/api/checkout/route.ts",
      "to": "file:lib/stripe.ts",
      "kind": "uses",
      "label": "uses stripe",
      "locations": [
        {
          "path": "app/api/checkout/route.ts",
          "line": 3,
          "role": "import",
          "code": "import { stripe } from '@/lib/stripe';"
        },
        {
          "path": "app/api/checkout/route.ts",
          "line": 6,
          "role": "use",
          "code": "const session = await stripe.checkout.sessions.create({"
        }
      ]
    },
    {
      "id": "file:app/api/checkout/route.ts->setting:NEXT_PUBLIC_SITE_URL",
      "from": "file:app/api/checkout/route.ts",
      "to": "setting:NEXT_PUBLIC_SITE_URL",
      "kind": "reads-setting",
      "label": "reads setting",
      "locations": [
        {
          "path": "app/api/checkout/route.ts",
          "line": 9,
          "role": "use",
          "code": "success_url: `${process.env.NEXT_PUBLIC_SITE_URL}/dashboard`,"
        }
      ]
    },
    {
      "id": "file:app/api/users/[id]/route.ts->database:postgres",
      "from": "file:app/api/users/[id]/route.ts",
      "to": "database:postgres",
      "kind": "writes",
      "label": "deletes from users",
      "locations": [
        {
          "path": "app/api/users/[id]/route.ts",
          "line": 5,
          "role": "use",
          "code": "await db.user.delete({ where: { id } });"
        }
      ],
      "details": [
        "users"
      ]
    },
    {
      "id": "file:app/api/users/[id]/route.ts->file:lib/db.ts",
      "from": "file:app/api/users/[id]/route.ts",
      "to": "file:lib/db.ts",
      "kind": "uses",
      "label": "uses db",
      "locations": [
        {
          "path": "app/api/users/[id]/route.ts",
          "line": 1,
          "role": "import",
          "code": "import { db } from '@/lib/db';"
        },
        {
          "path": "app/api/users/[id]/route.ts",
          "line": 5,
          "role": "use",
          "code": "await db.user.delete({ where: { id } });"
        }
      ]
    },
    {
      "id": "file:app/api/users/route.ts->database:postgres",
      "from": "file:app/api/users/route.ts",
      "to": "database:postgres",
      "kind": "writes",
      "label": "reads and saves users",
      "locations": [
        {
          "path": "app/api/users/route.ts",
          "line": 8,
          "role": "use",
          "code": "const users = await db.user.findMany({ select: { id: true, email: true } });"
        },
        {
          "path": "app/api/users/route.ts",
          "line": 14,
          "role": "use",
          "code": "const user = await db.user.create({ data: { email, passwordHash: await hash(password) } });"
        }
      ],
      "details": [
        "users"
      ]
    },
    {
      "id": "file:app/api/users/route.ts->file:lib/db.ts",
      "from": "file:app/api/users/route.ts",
      "to": "file:lib/db.ts",
      "kind": "uses",
      "label": "uses db",
      "locations": [
        {
          "path": "app/api/users/route.ts",
          "line": 3,
          "role": "import",
          "code": "import { db } from '@/lib/db';"
        },
        {
          "path": "app/api/users/route.ts",
          "line": 8,
          "role": "use",
          "code": "const users = await db.user.findMany({ select: { id: true, email: true } });"
        }